{
  "id": "evidence-data-generating-process",
  "source": "openintro-statistics",
  "locator": {
    "type": "section",
    "value": "textbook overview and table of contents",
    "section": "curriculum comparison"
  },
  "evidence_role": "curriculum",
  "supports": [
    "data-generating-process-claim"
  ],
  "extracted_meaning": {
    "ja": "データ生成過程は、統計学の導入から応用へ進むための共通要素として整理した。",
    "en": "Data-Generating Process is included as a shared element in the path from introductory ideas to application in Statistics."
  },
  "confidence": "high"
}
