{
  "id": "evidence-random-variables",
  "source": "openintro-statistics",
  "locator": {
    "type": "section",
    "value": "textbook overview and table of contents",
    "section": "curriculum comparison"
  },
  "evidence_role": "curriculum",
  "supports": [
    "random-variables-claim"
  ],
  "extracted_meaning": {
    "ja": "確率変数は、統計学の導入から応用へ進むための共通要素として整理した。",
    "en": "Random Variables is included as a shared element in the path from introductory ideas to application in Statistics."
  },
  "confidence": "high"
}
