{
  "id": "evidence-covariance-and-correlation",
  "source": "openintro-statistics",
  "locator": {
    "type": "section",
    "value": "textbook overview and table of contents",
    "section": "curriculum comparison"
  },
  "evidence_role": "curriculum",
  "supports": [
    "covariance-and-correlation-claim"
  ],
  "extracted_meaning": {
    "ja": "共分散と相関は、統計学の導入から応用へ進むための共通要素として整理した。",
    "en": "Covariance and Correlation is included as a shared element in the path from introductory ideas to application in Statistics."
  },
  "confidence": "high"
}
