{
  "id": "evidence-sampling-and-bias",
  "source": "openintro-statistics",
  "locator": {
    "type": "section",
    "value": "textbook overview and table of contents",
    "section": "curriculum comparison"
  },
  "evidence_role": "curriculum",
  "supports": [
    "sampling-and-bias-claim"
  ],
  "extracted_meaning": {
    "ja": "標本抽出とバイアスは、統計学の導入から応用へ進むための共通要素として整理した。",
    "en": "Sampling and Bias is included as a shared element in the path from introductory ideas to application in Statistics."
  },
  "confidence": "high"
}
