{
  "id": "evidence-multiple-regression-and-glm",
  "source": "openintro-statistics",
  "locator": {
    "type": "section",
    "value": "textbook overview and table of contents",
    "section": "curriculum comparison"
  },
  "evidence_role": "curriculum",
  "supports": [
    "multiple-regression-and-glm-claim"
  ],
  "extracted_meaning": {
    "ja": "重回帰と一般化線形モデルは、統計学の導入から応用へ進むための共通要素として整理した。",
    "en": "Multiple Regression and Generalized Linear Models is included as a shared element in the path from introductory ideas to application in Statistics."
  },
  "confidence": "high"
}
