{
  "id": "evidence-quantiles-and-robustness",
  "source": "openintro-statistics",
  "locator": {
    "type": "section",
    "value": "textbook overview and table of contents",
    "section": "curriculum comparison"
  },
  "evidence_role": "curriculum",
  "supports": [
    "quantiles-and-robustness-claim"
  ],
  "extracted_meaning": {
    "ja": "分位点と頑健性は、統計学の導入から応用へ進むための共通要素として整理した。",
    "en": "Quantiles and Robustness is included as a shared element in the path from introductory ideas to application in Statistics."
  },
  "confidence": "high"
}
